name,nid,image,priceShow,voucher,ratingScore,review,location,sellerName,brandName,originalPrice,inStock,itemUrl
đt giá rẻ chính hãng Camera 48+24MP Điện thoại giá rẻ Trung Quốc Hỗ trợ kiểm tra hàng hóa giá rẻ học sinh Hàng mới về Điện thoại Siêu CPU Mobile,3162138154,https://sg-test-11.slatic.net/p/f055af5827fde28ee9f88af8a0bfcfb6.jpg,1.188.554 ₫,Voucher giảm  47%,,,Hà Nội,ysa6r589,No Brand,2225277,True,https://www.lazada.vn/products/pdp-i3162138154.html
"Điện thoại Honor X9c 5G 12GB + 256GB | Pin 6600mAh, Camera 108MP | Bảo hành 18 Tháng| Hàng Chính Hãng",2944455536,https://vn-live-01.slatic.net/p/1eb885ce7175940847f8c8dbcc108bf1.png,8.589.000 ₫,,4.963636363636364,54,Long An,HONOR Vietnam,Honor,11490000,True,https://www.lazada.vn/products/pdp-i2944455536.html
Điện Thoại Di Động giá rẻ S23 Ultra Chính Hãng Murah Màn Hình Full HD 7.3Inch Bộ Nhớ 3+32GB Hai Thẻ Sim Camera HD 32+64MP Pin 6800mAh chính hãng giá rẻ,2380571001,https://vn-live-01.slatic.net/p/58d5d9004c63fcbab4ad61b095afdc3e.jpg,1.174.700 ₫,Voucher giảm  48%,,,Hà Nội,điện tử kỹ thuật số 3C,No Brand,2247800,True,https://www.lazada.vn/products/pdp-i2380571001.html
Điện thoại Realme C3 Ram 3GB bộ nhớ 32GB máy zin full chức năng pin 5000 mAh tặng kèm 1 ốp lưng,2637133831,https://vn-live-01.slatic.net/p/1bdf672cf7754ee893a408cec31a2a9d.jpg,1.190.000 ₫,Voucher giảm  15%,5.0,1,Hồ Chí Minh,Di Động Khmer Sài Gòn,No Brand,1400000,True,https://www.lazada.vn/products/pdp-i2637133831.html
Điện Thoại S23 Ultra Điện Tử Giảm Đến 50% Máy Ảnh HD 4+64 Gb MỚI Sẵn Tiếng Việt Chơi Ngon Lành Học Điện Thoại Mới Giá Rẻ,2652848294,https://sg-test-11.slatic.net/p/ac704d86b8efa3e605aeb02197aef43e.jpg,1.170.000 ₫,Voucher giảm  45%,5.0,1,Hà Nội,điện tử kỹ thuật số 3C,No Brand,2140000,True,https://www.lazada.vn/products/pdp-i2652848294.html
Điện Thoại Samsung Galaxy A06 4GB/64GB - Hàng Chính Hãng,2959095913,https://vn-live-01.slatic.net/p/0e8c1cd9db09b14d2768813a5459f530.jpg,2.284.000 ₫,,5.0,3,Bến Tre,Hồng Hạnh Mobile Mall,Samsung,3190000,True,https://www.lazada.vn/products/pdp-i2959095913.html
Điện thoại di động hoàn toàn mới oqqo Reno9 HD6.7 inch điện thoại thông minh điện thoại di động,3160665155,https://vn-live-01.slatic.net/p/f7ebacee7e6c580885897c230c23537d.jpg,1.380.000 ₫,,,,Hà Nội,Át 3C,SOYES,,True,https://www.lazada.vn/products/pdp-i3160665155.html
Điện thoại di động Honor X5b (4+64GB) - Bảo hành 12 tháng,3090649261,https://vn-live-01.slatic.net/p/7c194cd458267d29f2dc1bb6b903cf7a.jpg,2.119.000 ₫,,,,Hồ Chí Minh,PHONG VU Official Store,Honor,2990000,True,https://www.lazada.vn/products/pdp-i3090649261.html
Chính Hãng điện thoại cảm ứng giá rẻ Hỗ trợ 2 SIM Mobile mướt game Android phone Bộ nhớ 6+128GB gaming phone Màn hình AMOLED đien thoại giá rẻ nhất Siêu CPU Điện thoại tầm trung Android Cellphones Màn hình lớn 5.0inch Điện,3097235339,https://sg-test-11.slatic.net/p/dba9082b1abb5b3e2f947d9138b5aa7a.jpg,1.258.198 ₫,Voucher giảm  50%,,,Hà Nội,Pzi5i125,No Brand,2516396,True,https://www.lazada.vn/products/pdp-i3097235339.html
điện thoại giá rẽ Hỗ trợ kiểm tra hàng hóa Mới 100% Giảm giá sốc điện thoại việt nam Camera 108+50MP Mobilephone Màn hình AMOLED học sinh giá rẻ,3081030575,https://sg-test-11.slatic.net/p/7bf22010daf38e1881058c350b60744f.jpg,1.044.938 ₫,Voucher giảm  46%,,,Hà Nội,O้racl1e021,No Brand,1935070,True,https://www.lazada.vn/products/pdp-i3081030575.html
đt chính hãng Màn hình AMOLED điện thoại trung quốc Tiếng Việt siêu mượt Cellphones Cấu hình mạnh đỉnh Bảo hành miễn phí đt giá rẻ chính hãng,3129667150,https://sg-test-11.slatic.net/p/733e60e3e99384c85d8b75a72e2238e4.jpg,1.092.849 ₫,Voucher giảm  45%,,,Hà Nội,ysa6r589,No Brand,1980894,True,https://www.lazada.vn/products/pdp-i3129667150.html
Điện thoại Samsung galaxy Note 20 5G 2 sim Likenew - Fullbox,2093580613,https://vn-live-01.slatic.net/p/b6b50e30dab1bf1c75b6e77c2fc2b7bd.jpg,5.590.000 ₫,Voucher giảm  25%,4.96969696969697,33,Hồ Chí Minh,didongso1.com,Samsung,7500000,True,https://www.lazada.vn/products/pdp-i2093580613.html
đien thoại giá rẻ nhất bản Quốc tế đt thông minh giá rẻ handphone Màn hình AMOLED Mobile Sạc nhanh Bảo hành miễn phí Điện thoại phổ thông,3162136123,https://sg-test-11.slatic.net/p/c4e0fb94b45e6e03bc3d9b076bade750.jpg,1.196.327 ₫,Voucher giảm  45%,,,Hà Nội,ysa6r589,No Brand,2171186,True,https://www.lazada.vn/products/pdp-i3162136123.html
Điện Thoại Di Động S23 Ultra HD Tốc Độ Làm Mới Cao 6.7 Bộ Nhớ 16 + 1TB Android Chụp Ảnh HD 72MP + 108MP Pin Lớn 6800MAh Dual Card SIM Trò Chơi Điện Thoại Thông Minh XEM TV,2657488446,https://sg-test-11.slatic.net/p/7838b4c2285cc690f3a6b718dee4e99f.jpg,1.494.000 ₫,Voucher giảm  50%,,,Hà Nội,Chỉ vì 3C,No Brand,2988000,True,https://www.lazada.vn/products/pdp-i2657488446.html
Điện thoại Samsung galaxy M31 Ram 6G bộ nhớ 64GB  Pin 6000 mAh máy chính hãng tặng kèm ốp lưng cường lực,2539508878,https://vn-live-01.slatic.net/p/0ea8049314f5c7b27db14984d43c801b.jpg,1.590.000 ₫,Voucher giảm  6%,5.0,2,Hồ Chí Minh,Di Động Khmer Sài Gòn,Samsung,1700000,True,https://www.lazada.vn/products/pdp-i2539508878.html
"Điện thoại Honor X5b 4GB+64GB | Pin 5200mAh 90Hz | Màn hình 6.56"" | BH 18 Tháng Hàng Chính Hãng",2967101620,https://vn-live-01.slatic.net/p/48618dd1e912b18c8e92ab4a9e86af70.png,2.189.000 ₫,,4.636363636363637,33,Long An,HONOR Vietnam,Honor,2790000,True,https://www.lazada.vn/products/pdp-i2967101620.html
"Điện thoại thông minh S23 Ultra 5G Màn hình 7,5 inch HD 12GB + 512GB bộ nhớ mở rộng Android12 AMOLED điện thoại di động giá rẻ điện thoại di động học tập dành cho sinh viên",2531257509,https://sg-test-11.slatic.net/p/2f8e53f622e94fa6801066bdb40a4a4d.jpg,1.366.827 ₫,Voucher giảm  49%,,,Hà Nội,Trimei Zhenpin,SOYES,2654299,True,https://www.lazada.vn/products/pdp-i2531257509.html
2025 S24 Ultra điện thoại di động thông minh 7.3 inch Android đt 3G/4G/5G giá rẻ 12GB/512GB HD Toàn màn hình điện thoại rẻ cho học sinh Hai SIM Với bút Smartphone cảm ứng,3037538477,https://vn-live-01.slatic.net/p/e95adfeb6acc659c9720fff22ab86e84.jpg,1.575.252 ₫,Voucher giảm  53%,5.0,1,Hà Nội,Át 3C,SOYES,3384000,True,https://www.lazada.vn/products/pdp-i3037538477.html
điện thoại cảm ứng giá rẻ Pin trâu 6800mAh Bán giá rẻ 7.3inch điện thoại màn hình to giá rẻ Hàng mới về Bảo hành miễn phí Màn hình AMOLED giá bán rẻ,3065225453,https://sg-test-11.slatic.net/p/abad9d38a6fa4b4e8c81732a3aab2e91.jpg,1.125.836 ₫,Voucher giảm  46%,,,Hà Nội,Pzi5i125,No Brand,2080683,True,https://www.lazada.vn/products/pdp-i3065225453.html
Đt bản Quốc tế điện thoại cảm ứng mướt game đt thông minh giá rẻ Pin trâu 6800mAh điện thoại thông minh Giảm giá sốc Mobilephone,3084062360,https://vn-live-01.slatic.net/p/77f4303631c1b62b3f68baf7748342ca.jpg,932.963 ₫,Voucher giảm  46%,1.0,1,Hà Nội,Pzi5i125,No Brand,1716385,True,https://www.lazada.vn/products/pdp-i3084062360.html
đt thông minh giá rẻ Pin Lớn 6800mAh điện thoại rẻ đánh mọi gaming nặng chất đt giá rẻ chính hãng Hàng mới về  Điện thoại Giá mềm 7.3inch Mobilephone,2963678316,https://vn-live-01.slatic.net/p/e3dd9d894abbeae6423549964fa80ce0.jpg,1.135.545 ₫,Voucher giảm  44%,,,Hà Nội,O้racl1e021,No Brand,2027759,True,https://www.lazada.vn/products/pdp-i2963678316.html
Điện thoại Cấu hình mạnh đỉnh Điện thoại Giá mềm Pin trâu 6800mAh Điện thoại cao cấp Màn hình lớn 6.7 inch điện thoại thanh lý giá rẻ phiên bản Việt Namđien thoại giá rẻ nhất Siêu CPU điện thoại cảm ứng Hỗ trợ 4G/5G giá rẻ học sinh Android điên thoại,3066496174,https://vn-live-01.slatic.net/p/8afaca03faa4415886bf7e34562c994e.jpg,1.270.670 ₫,Voucher giảm  49%,,0,Hà Nội,ysa6r589,No Brand,2470144,True,https://www.lazada.vn/products/pdp-i3066496174.html
"Miễn phí vận chuyển S23 Ultra Android 16GB + 1TB Màn hình điện thoại di động 7,3 inch Điện thoại di động 5G WiFi Bluetooth Nghe nhạc êm dịu và chơi game mượt mà",2597338074,https://sg-test-11.slatic.net/p/858cf467826617e73dd39162be84a41c.jpg,1.267.868 ₫,Voucher giảm  50%,,,Hà Nội,tiệm 3C,SOYES,2535736,True,https://www.lazada.vn/products/pdp-i2597338074.html
điên thoại Camera 108/50MP  điện thoại rẻ Màn hình AMOLED điện thoại gaming Siêu CPU điện thoại cảm ứng giá rẻ Android Đt Siêu mượt đ𝗂ện thoạ𝗂 chính hãng g𝗂á rẻ Hàng mới về Điện thoại dưới 2 triệu Hỗ trợ 4G/5G Điện thoại cao cấp,3065483154,https://vn-live-01.slatic.net/p/3fd10f1b40851cdbfbb3c1972e6070b3.jpg,1.161.370 ₫,Voucher giảm  46%,,,Hà Nội,Pzi5i125,No Brand,2139152,True,https://www.lazada.vn/products/pdp-i3065483154.html
Điện thoại GALAXY A13 Ram 6G/128GB máy qua sự dụng zin đẹp 99 chính hãng kèm phụ kiện,2539971659,https://vn-live-01.slatic.net/p/ed7ce9b4625fb11f2fc2efa29ba05338.jpg,1.990.000 ₫,Voucher giảm  9%,5.0,1,Hồ Chí Minh,Di Động Khmer Sài Gòn,No Brand,2190000,True,https://www.lazada.vn/products/pdp-i2539971659.html
đien thoại giá rẻ nhất Hàng mới về Giao hàng nhận tiền Cấu hình mạnh đỉnh gaming phone Pin trâu 6800mAh Điện thoại phổ thông Hỗ trợ 4G/5G điện thoại giá siêu rẻ Vi xử lý 10 nhân Cellphones Android điện thoại cảm ứng Camera 108/50MP  Đt,2952510694,https://vn-live-01.slatic.net/p/053e748821c3f0a3bcec0fcb1347fed4.jpg,1.121.300 ₫,Voucher giảm  46%,,,Hà Nội,O้racl1e021,No Brand,2067119,True,https://www.lazada.vn/products/pdp-i2952510694.html
Hỗ trợ 4G/5G Điện thoại tầm trung Màn hình lớn 5.0 inchGiao hàng nhận tiền Hàng mới về điện thoại Vi xử lý 10 nhân mới nguyên bản bản Quốc tế Cellphones siêu mượt điện thoại trung quốc Màn hình AMOLED đt thông,3041433539,https://sg-test-11.slatic.net/p/0aea048fe6f3e085c5c086cbea1c3f24.jpg,1.276.319 ₫,Voucher giảm  41%,,,Hà Nội,Pzi5i125,No Brand,2163253,True,https://www.lazada.vn/products/pdp-i3041433539.html
đt rẻ Pin trâu 8000mAh Android Mobile phiên bản Việt Nam điện thoại pin trâu Hỗ trợ 2 SIM Điện thoại dưới 2 triệu Siêu mượt Smartphone Bộ nhớ 16+1TB Điện thoại Hỗ trợ tiếng Việt trên điện thoại màn hình to giá rẻ Hỗ trợ 4G/5G Điện thoại tầm trung,3046234079,https://vn-live-01.slatic.net/p/0875efb89b3217e6ebab61036982cc4f.jpg,1.186.762 ₫,Voucher giảm  41%,,,Hà Nội,Pzi5i125,No Brand,2015482,True,https://www.lazada.vn/products/pdp-i3046234079.html
Điện thoại tầm trung mướt game Đt Hỗ trợ kiểm tra hàng hóa điện thoại thanh lý giá rẻ Bộ nhớ 16+1TB Android phone Màn hình AMOLED đt rẻ,3166297177,https://sg-test-11.slatic.net/p/d944fae80b8067281f108981dd90aedf.jpg,1.204.358 ₫,Voucher giảm  47%,,,Hà Nội,ysa6r589,No Brand,2272374,True,https://www.lazada.vn/products/pdp-i3166297177.html
Điện thoại Redmi Note 11S Ram 8GB/128GB máy chính hãng PIN 5000 mAh,2557234330,https://vn-live-01.slatic.net/p/c4e2da68099eaf3edfa483ea1148d295.jpg,2.131.990 ₫,Voucher giảm  14%,5.0,3,Hồ Chí Minh,Di Động Khmer Sài Gòn,No Brand,2490000,True,https://www.lazada.vn/products/pdp-i2557234330.html
Điện thoại S23 Ultra giao hàng siêu nhanh Deal Điện Tử Giảm Đến 50% Android mới 12+256GB Bán Giá rẻ săn sele Điện thoại di động,2424976148,https://vn-live-01.slatic.net/p/a98a296afb09e4bbc240184c1c3f885f.png,1.395.500 ₫,Voucher giảm  50%,,,Hà Nội,Trimei Zhenpin,No Brand,2791000,True,https://www.lazada.vn/products/pdp-i2424976148.html
đt giá siêu rẻ đánh mọi gaming nặng chất điện thoại tồn kho mướt game giá bán rẻ Sạc nhanh Điện Thoại Thông Minh Cấu hình mạnh đỉnh Mobilephone,2952739210,https://vn-live-01.slatic.net/p/b4465625311e575e292660a3d9ff7d89.jpg,1.210.069 ₫,Voucher giảm  43%,,,Hà Nội,O้racl1e021,No Brand,2122928,True,https://www.lazada.vn/products/pdp-i2952739210.html
điện thoại gia rẻ học sinh Sạc nhanh đt chính hãng Hàng mới về điện thoại chơi game Hỗ trợ kiểm tra hàng hóa NEW 5G Phone Chính Hãng đt giá học sinh,3163657825,https://sg-test-11.slatic.net/p/95d74efa6c3c3ffefc8a9a0a9f476f3b.jpg,1.103.923 ₫,Voucher giảm  45%,,,Hà Nội,ysa6r589,No Brand,2019915,True,https://www.lazada.vn/products/pdp-i3163657825.html
điện thoại gia rẻ học sinh 6.7inch Mới 100% Bộ nhớ 12+512GB đt chính hãng Camera 48+24MP điện thoại pin trâu Pin Lớn 5600mAh đt chính hãng Android,2277590301,https://vn-live-01.slatic.net/p/ade510608129004d3455458a3fba3afa.jpg,1.203.727 ₫,Voucher giảm  43%,,,Hà Nội,O้racl1e021,No Brand,2111802,True,https://www.lazada.vn/products/pdp-i2277590301.html
điện thoại android Hàng mới về Điện thoại Cấu hình mạnh đỉnh điện thoại thông minh Hỗ trợ kiểm tra hàng hóa Điện thoại di động Chính Hãng Android Mobile Hỗ trợ 2 SIM Nguyên bản mới Sạc nhanh đt giá rẻ cho hs Bộ nhớ,3129632143,https://sg-test-11.slatic.net/p/67112311d4d3b228c17e51902d780438.jpg,1.361.236 ₫,Voucher giảm  48%,,,Hà Nội,ysa6r589,No Brand,2617762,True,https://www.lazada.vn/products/pdp-i3129632143.html
Điện thoại Samsung galaxy M21 Ram 6G bộ nhớ 64GB máy zin full chức năng pin 6000 mAh tặng kèm 1 ốp lưng,2634432349,https://vn-live-01.slatic.net/p/421bff6f5f76f61d2acd6c916fc7e629.jpg,1.390.000 ₫,Voucher giảm  23%,5.0,3,Hồ Chí Minh,Di Động Khmer Sài Gòn,Samsung,1800000,True,https://www.lazada.vn/products/pdp-i2634432349.html
đt giá rẻ cho hs Sạc nhanh điện thoại việt nam Bảo hành miễn phí Hỗ trợ 4G/5G New Arrival Chính Hãng mới nguyên bản đt thông minh giá rẻ,2606891085,https://vn-live-01.slatic.net/p/de014669c7695f677374e13b1f06dc08.jpg,1.119.679 ₫,Voucher giảm  47%,,,Hà Nội,ysa6r589,No Brand,2112602,True,https://www.lazada.vn/products/pdp-i2606891085.html
"Galaxy S23 Ultra+ điện thoại di động bán giảm giá bản gốc 2023 100 phần trăm với một máy ảnh hd chi phí thấp 6, 7 inch 16GB+512GB máy ảnh điện thoại thông minh sạc điện thoại di động COD",2508377249,https://sg-test-11.slatic.net/p/31679d613e7ce8c5d9016aeddaeaf789.jpg,1.360.127 ₫,Voucher giảm  49%,,,Hà Nội,Trimei Zhenpin,SOYES,2654299,True,https://www.lazada.vn/products/pdp-i2508377249.html
điên thoại gia rẻ Hàng mới về đt giá rẻ cho hs Giảm giá sốc Điện thoại phổ thông Hỗ trợ 4G/5G Mobile Cấu hình mạnh đỉnh dt gia rẻ,3160993711,https://sg-test-11.slatic.net/p/126aef3bbea1d0c1bdfa4545cffaf67e.jpg,1.212.004 ₫,Voucher giảm  43%,,,Hà Nội,ysa6r589,No Brand,2116126,True,https://www.lazada.vn/products/pdp-i3160993711.html
Màn hình AMOLED điện thoại pin trâu Sạc nhanh điện thoại cảm ứng giá rẻ Camera 48/24MP  điện thoại rẻ cho học sinh Hỗ trợ 2 SIM điện thoại giá học sinh Bộ nhớ 8+128GB điện thoại cho học sinh Siêu CPU New Arrival,3084011581,https://sg-test-11.slatic.net/p/daf55835c69075658190281e89ed60ca.jpg,1.171.843 ₫,Voucher giảm  50%,,,Hà Nội,O้racl1e021,No Brand,2343686,True,https://www.lazada.vn/products/pdp-i3084011581.html
dien thoai mướt game điện thoại thông minh đánh mọi gaming nặng chất đt thông minh giá rẻ Bộ nhớ 16+512GB điện thoại giá 1kk Vi xử lý 10 nhân Mới 100% Siêu CPU Điện thoại tầm trung Cấu hình mạnh đỉnh Điện thoại giá,3163468755,https://sg-test-11.slatic.net/p/2d7f58ad9e6b14e727602bfbf90eff7f.jpg,1.350.770 ₫,Voucher giảm  43%,,,Hà Nội,ysa6r589,No Brand,2357149,True,https://www.lazada.vn/products/pdp-i3163468755.html
Smartphone Hàng mới về điện thoại android siêu mượt đt giá rẻ chính hãng mướt game điện thoại chơi game Camera 72+48MP  điện thoại Giá Rẻ Hỗ trợ 2 SIM điện thoại giá rẽ Cấu hình mạnh đỉnh dt gia rẻ Pin trâu 7300mAh,3065179926,https://vn-live-01.slatic.net/p/ae08e4397fb5897ebad420a312ed0eaf.jpg,1.462.103 ₫,Voucher giảm  48%,,,Hà Nội,Pzi5i125,No Brand,2804404,True,https://www.lazada.vn/products/pdp-i3065179926.html
Điện thoại Redmi Note 11 Pro 5G Ram 8G/128GB máy chính hãng zin đẹp full chức năng tặng kèm 1 ốp lưng,2652997643,https://vn-live-01.slatic.net/p/9d06d4e2bbdc2542d5a74b6789cf2e91.jpg,2.783.690 ₫,Voucher giảm  13%,5.0,4,Hồ Chí Minh,Di Động Khmer Sài Gòn,No Brand,3190000,True,https://www.lazada.vn/products/pdp-i2652997643.html
điên thoại gia rẻ Màn hình AMOLED đt giá rẻ cho hs Pin trâu 7800mAh điện thoại rẻ nhất Hỗ trợ kiểm tra hàng hóa mới nguyên bản Sạc nhanh Mới 100%,3069345271,https://sg-test-11.slatic.net/p/28796fc6f5be8a1322194e0d2b445051.jpg,1.118.642 ₫,Voucher giảm  47%,,,Hà Nội,O้racl1e021,No Brand,2110645,True,https://www.lazada.vn/products/pdp-i3069345271.html
Điện thoại Redmi 9c  Ram 3GB bộ nhớ 64GB máy zin full chức năng pin 6000 mAh tặng kèm 1 ốp lưng,2634637573,https://vn-live-01.slatic.net/p/0a0de44bff1cb7406df0816cb5555437.jpg,1.107.890 ₫,Voucher giảm  14%,5.0,1,Hồ Chí Minh,Di Động Khmer Sài Gòn,Xiaomi,1290000,True,https://www.lazada.vn/products/pdp-i2634637573.html
đt siêu rẻ Cấu hình mạnh đỉnh Điện thoại giá rẻ Trung Quốc Hỗ trợ 4G/5G dt gia rẻ siêu mượt Điện thoại phổ thông Hỗ trợ 2 SIM Smartphone,3097000379,https://sg-test-11.slatic.net/p/8d935615c3976517bad5f019f2d709e4.jpg,1.014.537 ₫,Voucher giảm  43%,,,Hà Nội,ysa6r589,No Brand,1783125,True,https://www.lazada.vn/products/pdp-i3097000379.html
dien thoai Chính Hãng thanh lý giá điện thoại Mobilephone Pin trâu 6000mAh New Arrival Màn hình AMOLED Android phone Điện thoại cao cấp,3164466556,https://sg-test-11.slatic.net/p/adc726be1d159b39124e4bb6dd1408ac.jpg,1.101.845 ₫,Voucher giảm  49%,,,Hà Nội,ysa6r589,No Brand,2160480,True,https://www.lazada.vn/products/pdp-i3164466556.html
Sạc nhanh Android phone Bộ nhớ 8+128GB gaming phone Màn hình AMOLED đien thoại giá rẻ nhất Android Cellphones Cấu hình mạnh đỉnh đt chính hãng mướt game Điện thoại giá sinh viên Siêu CPU Mobile Chính Hãng dt giá rẻ,3121239210,https://sg-test-11.slatic.net/p/512beb42c89ce4b27103cb62f7501cd5.jpg,1.291.942 ₫,Voucher giảm  46%,,,Hà Nội,Pzi5i125,No Brand,2392485,True,https://www.lazada.vn/products/pdp-i3121239210.html
đt giá rẻ chính hãng Vi xử lý 10 nhân điện thoại thanh lý giá rẻ Android Mobile Sạc nhanh Smartphone Camera 50+32MP Bảo hành miễn phí Bán giá rẻ,3028419420,https://sg-test-11.slatic.net/p/f9b7266d78dc7a0e52eab0f249e66ff4.jpg,1.207.389 ₫,Voucher giảm  43%,,,Hà Nội,Pzi5i125,No Brand,2118226,True,https://www.lazada.vn/products/pdp-i3028419420.html
Điện thoại Samsung Galaxy A21S Ram 6GB bộ nhớ 64GB máy zin full chức năng pin 5000 mAh tặng kèm 1 ốp lưng,2638922442,https://vn-live-01.slatic.net/p/c844e24a02ce73141db9437c5f357a3d.jpg,1.387.190 ₫,Voucher giảm  13%,5.0,2,Hồ Chí Minh,Di Động Khmer Sài Gòn,Samsung,1590000,True,https://www.lazada.vn/products/pdp-i2638922442.html
5.8inch Đt giá rẻ cho hs Pin Lớn 4800mAh điện thoại thông minh Android điện thoại giá rẻ Mạng 5G Giao hàng nhận tiền Hàng mới về NEW 5G Phone Hỗ trợ 2 SIMĐiện thoại phổ thông Vi xử lý 10 nhân thanh lý giá điện,3024461934,https://sg-test-11.slatic.net/p/cd4de8b1b29a743a19342901e6fd2c97.jpg,1.354.680 ₫,Voucher giảm  41%,,,Hà Nội,Pzi5i125,No Brand,2296068,True,https://www.lazada.vn/products/pdp-i3024461934.html
điện thoại tồn kho Bộ nhớ 12+512GB Siêu CPU đt giá rẻ Cấu hình mạnh đỉnh Bán giá rẻ Sạc nhanh điện thoại chơi game Android đánh mọi gaming nặng chất,2303142432,https://vn-live-01.slatic.net/p/1517d6f918be753e969b8c5a6dd6ba2c.jpg,1.128.650 ₫,Voucher giảm  43%,,,Hà Nội,O้racl1e021,No Brand,1980088,True,https://www.lazada.vn/products/pdp-i2303142432.html
Mới S24 Ultra điện thoại di động 6.8 inch Android đt Máy ảnh 3G/4G/5G giá rẻ 6GB/128GB HD màn hình điện thoại rẻ cho học sinh Hai SIM Với bút Smartphone Cảm ứng,3064337553,https://vn-live-01.slatic.net/p/c4aa48330988800b24312bb8b4a3bbec.jpg,1.287.000 ₫,Voucher giảm  50%,,,Hà Nội,Át 3C,SOYES,2574000,True,https://www.lazada.vn/products/pdp-i3064337553.html
Mới S23 Cực Điện Thoại Thông Minh Android Dual Sim 6800MAh 6.8 HD Màn Hình Điện Thoại Pro Mở Khóa Phiên Bản Toàn Cầu 5G Di Động Điện Thoại Chính Hãng,2575834127,https://sg-test-11.slatic.net/p/c9862cee11f0d18120a91a703f315e38.jpg,1.365.068 ₫,Voucher giảm  50%,,,Hà Nội,thành phố điện tử kỹ thuật số,No Brand,2730136,True,https://www.lazada.vn/products/pdp-i2575834127.html
Đt 6.8inch Điện thoại Giá mềm handphone bản Quốc tế Feature phones Vi xử lý 10 nhân Bảo hành miễn phí đt thông minh giá rẻ,3020694048,https://sg-test-11.slatic.net/p/5a3944b2f6321ca6501b900a39b4c1f9.jpg,1.105.045 ₫,Voucher giảm  43%,,,Hà Nội,O้racl1e021,No Brand,1938675,True,https://www.lazada.vn/products/pdp-i3020694048.html
Đt giá rẻ cho hs Cấu hình mạnh đỉnh điên thoại Bộ nhớ 12+512GB Siêu CPU giá rẻ học sinh đánh mọi gaming nặng chất dien thoai Hàng mới về Smartphone,2293419917,https://vn-live-01.slatic.net/p/9432cf635d6f442e7e81121b107a7568.jpg,1.126.535 ₫,Voucher giảm  43%,,,Hà Nội,O้racl1e021,No Brand,1976377,True,https://www.lazada.vn/products/pdp-i2293419917.html
Điện thoại giá sinh viên Hỗ trợ 4G/5G đt giá học sinh Hỗ trợ kiểm tra hàng hóa điện thoại việt nam bản Quốc tế Smartphone Sạc nhanh Đt,2318045450,https://vn-live-01.slatic.net/p/a91cb2b8307dc8d0ec69ac3027c980de.jpg,1.126.176 ₫,Voucher giảm  43%,,,Hà Nội,O้racl1e021,No Brand,1975747,True,https://www.lazada.vn/products/pdp-i2318045450.html
Điện thoại OPPO A1K ram 2GB bộ nhớ 32GB máy zin full chức năng pin 5000 mAh tặng kèm 1 ốp lưng,2638808771,https://vn-live-01.slatic.net/p/cb3c07bcb2aad0b2d545eddb5beac6a7.jpg,977.550 ₫,Voucher giảm  19%,5.0,2,Hồ Chí Minh,Di Động Khmer Sài Gòn,OPPO,1200000,True,https://www.lazada.vn/products/pdp-i2638808771.html
