name,nid,image,priceShow,voucher,ratingScore,review,location,sellerName,brandName,originalPrice,inStock,itemUrl
Điện Thoại OPPO A58 (6GB/128GB) - Hàng Chính Hãng,2395322903,https://vn-live-01.slatic.net/p/bd3a8315c441cad9bd1fdd903585c503.jpg,4.110.000 ₫,,4.9919946631087395,4497,Hà Nội,OPPO Brand Store,OPPO,4990000,True,https://www.lazada.vn/products/pdp-i2395322903.html
"Điện thoại di động chắc chắn Oukitel WP32 Pro, RAM 24Gb(6GB + 18GB),ROM 256GB,Màn hình 6 inch HD,camera 20MP, NFC)",3186795276,https://vn-live-01.slatic.net/p/5a35d35726d5c0c66bce948036e52789.jpg,1.025.000 ₫,,,,Phú Thọ,An Huy Mobile,No Brand,,True,https://www.lazada.vn/products/pdp-i3186795276.html
"[ SALE -RẺ VÔ ĐỊCH ] Điện thoại giá rẻ Samsung Galaxy M51 2sim ram 8G/128G, Cấu hình Cao Chiến mọi Game mượt, Chụp ảnh đẹp, g -máy đủ màu LNBSCK",2859462542,https://vn-live-01.slatic.net/p/2b9b8070b150f29a651ece82ea59579e.jpg,268.000 ₫,,4.575,79,Hồ Chí Minh,MYSON MOBILE,Samsung,,True,https://www.lazada.vn/products/pdp-i2859462542.html
điện thoại SS.A10s 2sim ram 3G bộ nhớ trong 32GB nguyên zin đẹp keng,3139382615,https://vn-live-01.slatic.net/p/8e51a053de362c17a98963be8200a5f3.jpg,585.692 ₫,"LazFlash Sale,kết thúc sau 7h",5.0,15,Hồ Chí Minh,Nguyên Lê Store,No Brand,1200000,True,https://www.lazada.vn/products/pdp-i3139382615.html
"điện thoại Xiaomi Redmi Note 10 2sim ram 6G/128G Chính hãng, cấu hình khủng Cân game mượt - CMS",2879921936,https://vn-live-01.slatic.net/p/f70e12540111588e284a786de00c3338.jpg,268.000 ₫,,4.52,25,Hồ Chí Minh,MYSON MOBILE,Xiaomi,,True,https://www.lazada.vn/products/pdp-i2879921936.html
Điện thoại samsung galaxy j6 plus 2018 máy cũ tân trang đẹp trên 95%,3065872797,https://vn-live-01.slatic.net/p/8d4bf8fd22df510a8e434123f8322db0.jpg,495.000 ₫,"LazFlash Sale,kết thúc sau 2 ngày",4.742268041237113,97,Hà Nội,Smartchoice 247,Samsung,1100000,True,https://www.lazada.vn/products/pdp-i3065872797.html
Samsung A01 Core androi go 11 siêu mượt hỗ trợ nhiều app giải trí,2768919232,https://filebroker-cdn.lazada.vn/kf/Saf884b7c56aa499ca216f20c6c798766O.jpg,480.000 ₫,,5.0,6,Hồ Chí Minh,Phone Cheap,Samsung,,True,https://www.lazada.vn/products/pdp-i2768919232.html
Điện thoại oppo neo5 _a31. Điện thoại gia rẻ HÀNG CHÍNH HÃNG đã qua sử dụng,2500695835,https://vn-live-01.slatic.net/p/d4c9552401491715c894b69f9a7cac21.jpg,289.999 ₫,Voucher giảm  3%,4.421052631578948,76,Hải Phòng,LPK_dienthoaigiare,OPPO,299000,True,https://www.lazada.vn/products/pdp-i2500695835.html
"[ RẺ VÔ ĐỊCH ] điện thoại 4G Samsung Galaxy Note 9 ram 6G/128G Chính Hãng,  Chiến Game mượt, Chụp ảnh siêu đẹp - BBMB",2880862317,https://vn-live-01.slatic.net/p/d07b4f0060313a59404074904ad4deff.jpg,268.000 ₫,,4.859649122807017,57,Hồ Chí Minh,MYSON MOBILE,Samsung,,True,https://www.lazada.vn/products/pdp-i2880862317.html
"[ RẺ HỦY DIỆT ] điện thoại 4G Samsung Galaxy S8 Plus ram 4G/64G Chính Hãng,Chiến Game mượt, Chụp ảnh siêu đẹp - Máy đủ màu MBMB",2881337774,https://vn-live-01.slatic.net/p/3a954e60bdd2b0a597d54f4fe86a5fa5.jpg,278.000 ₫,Voucher giảm  30%,5.0,21,Hồ Chí Minh,MYSON MOBILE,Samsung,397000,True,https://www.lazada.vn/products/pdp-i2881337774.html
Điện thoại di động Xiaomi Redmi 13 6GB/128GB - 8GB/128GB - Chính hãng bảo hành 18 tháng,3064853539,https://vn-live-01.slatic.net/p/ba3e4fa350653bf7c314a6c9b23edd09.jpg,2.890.000 ₫,Voucher giảm  28%,4.869565217391305,23,Hồ Chí Minh,Hoàng Hà Mobile,Xiaomi,3990000,True,https://www.lazada.vn/products/pdp-i3064853539.html
"[SIÊU SALE 9.9] [ĐỘC QUYÊN MÀU ĐEN] Điện thoại Samsung Galaxy A16 5G (4-128GB), màn hình Super AMOLED 6.7"", kháng bụi nước IP54, bền mượt 6 năm",3170665970,https://vn-live-01.slatic.net/p/c6db32a1dafdbd1aeb9d7bfb10a9d78c.jpg,4.489.000 ₫,,5.0,7,Hồ Chí Minh,SAMSUNG Flagship Store,Samsung,,True,https://www.lazada.vn/products/pdp-i3170665970.html
Điện thoại di động hoàn toàn mới oqqo Reno9 HD6.7 inch điện thoại thông minh điện thoại di động,3160704236,https://vn-live-01.slatic.net/p/b73b2ae2cd4847ad10244fbdd4db9371.jpg,1.080.000 ₫,Voucher giảm  32%,,,Hà Nội,điện tử kỹ thuật số 3C,SOYES,1580000,True,https://www.lazada.vn/products/pdp-i3160704236.html
Điện Thoại Thông Minh Giá Rẻ Samsung Galaxy J2 prime G532 Hỗ Trợ 4G Máy Cũ Tân Trang,3065998302,https://vn-live-01.slatic.net/p/93aebb4ab6bb1f147ede09c69a38ccd2.jpg,241.250 ₫,Voucher giảm  52%,4.636363636363637,22,Hà Nội,Smartchoice 247,Samsung,500000,True,https://www.lazada.vn/products/pdp-i3065998302.html
NEW A55 điện thoại di động 6.8 inch Màn hình HD 3G/4G/5G giá rẻ Android đt 16GB/1TB điện thoại rẻ cho học sinh Hai SIM Smartphone Cảm ứng,3146273713,https://vn-live-01.slatic.net/p/178973b1f0848396603c4ec1ffe73bb1.png,1.198.000 ₫,Voucher giảm  50%,,,Hà Nội,Siêu thị 3C giá rẻ,SOYES,2396000,True,https://www.lazada.vn/products/pdp-i3146273713.html
Điện thoại 0PPP0 A1k 2SIM Bộ Nhớ Ram 2/32G Màn hình giọt nước zin đẹp,3051777186,https://vn-live-01.slatic.net/p/e794359bc1cd2f31280758b9a12d45b8.jpg,610.829 ₫,"LazFlash Sale,kết thúc sau 7h",5.0,28,Hồ Chí Minh,Nguyên Lê Store,Motorola,1409000,True,https://www.lazada.vn/products/pdp-i3051777186.html
Điện thoại di động Siêu CPU Đt Camera 108/72MP điện thoại giá siêu rẻ Android Giao hàng nhận tiền Cấu hình mạnh đỉnh Điện thoại phổ thông Pin trâu 8000mAh gaming phone Hỗ trợ 4G/5G đien thoại giá rẻ nhất Hàng mới về Cellphones,3020546831,https://vn-live-01.slatic.net/p/d311f26453796dee7ff00cdbb4b66388.jpg,1.204.960 ₫,Voucher giảm  41%,,,Hà Nội,O้racl1e021,No Brand,2053564,True,https://www.lazada.vn/products/pdp-i3020546831.html
A55 Nguyên bản mới Mạng 5G điên thoại gia rẻ Hỗ trợ 2 SIM Điện thoại di động 6.8inch điện thoại giá học sinh Bộ nhớ 16+1TB S,3177308534,https://vn-live-01.slatic.net/p/db125efb231c0f005c1addd4fea9386e.jpg,1.199.000 ₫,Voucher giảm  45%,,,Hà Nội,điện tử kỹ thuật số 3C,SOYES,2180000,True,https://www.lazada.vn/products/pdp-i3177308534.html
Oppo A55 Ram 4G/128GB máy zin full chức năng pin 5000 mAh tặng kèm 1 ốp lưng,2634466083,https://vn-live-01.slatic.net/p/7d82b8e793c351829ac528b8b89ed9db.jpg,1.590.000 ₫,Voucher giảm  20%,5.0,1,Hồ Chí Minh,Di Động Khmer Sài Gòn,OPPO,1980000,True,https://www.lazada.vn/products/pdp-i2634466083.html
Điện thoại Panasonic loại to sài tốt. Bảo hành 1 tháng. Giá 1 cái,2563293823,https://filebroker-cdn.lazada.vn/kf/S1cd773d501cf4165a7004acdf912a058b.jpg,130.000 ₫,,5.0,1,Hồ Chí Minh,589NhatTao,No Brand,,True,https://www.lazada.vn/products/pdp-i2563293823.html
Điện thoại di động hoàn toàn mới oqqo Reno9 HD6.7 inch điện thoại thông minh điện thoại di động,3168083069,https://vn-live-01.slatic.net/p/f7ebacee7e6c580885897c230c23537d.jpg,1.080.000 ₫,Voucher giảm  32%,,,Hà Nội,Chỉ vì 3C,SOYES,1580000,True,https://www.lazada.vn/products/pdp-i3168083069.html
Điện thoại di động 7.3inch đt chính hãng Camera108+78MP Điện thoại Vi xử lý 10 nhân handphone Hỗ trợ kiểm tra hàng hóa bán với giá thấp,3167883411,https://sg-test-11.slatic.net/p/84abae3ebf29ac50afa978d386c62274.jpg,968.874 ₫,Voucher giảm  48%,,,Hà Nội,ysa6r589,No Brand,1867717,True,https://www.lazada.vn/products/pdp-i3167883411.html
đien thoại giá rẻ nhất Hàng mới về Điện thoại phổ thông Hỗ trợ 2 SIM Mobile Hỗ trợ 4G/5G đt rẻ đánh mọi gaming nặng chất bán với giá thấp Camera 48+24MP  điện thoại cảm ứng giá rẻ Sạc nhanh điện thoại gia rẻ,3029569650,https://sg-test-11.slatic.net/p/e98e57fe685e849ddeaa0f27a8d6eb1c.jpg,1.412.543 ₫,Voucher giảm  45%,,,Hà Nội,Pzi5i125,No Brand,2571581,True,https://www.lazada.vn/products/pdp-i3029569650.html
sở hữu điện thoại di động giá rẻ S23 Ultra Bán di động ban đầu điện thoại mới ra 16+1T Bán điện thoại di động chính hãng Inch không thấm nước điện thoại chính hãng giá rẻ,2397146128,https://vn-live-01.slatic.net/p/a269fc8be32c6c7051f5e9cbf3f89596.jpg,1.321.989 ₫,Voucher giảm  50%,,,Hà Nội,Chỉ vì 3C,No Brand,2643800,True,https://www.lazada.vn/products/pdp-i2397146128.html
S24 Ultra 2024 Điện Thoại Di Động Mới 5G Thông Minh Android 12GB+512G 7.5inch Màn Hình Đầy Đủ Màn Hình Hd SIM+SD Hỗ Trợ Bluetooth WiFi GPS 6800mah,2655190806,https://sg-test-11.slatic.net/p/ce068594da5b074991d381e51866b9df.jpg,1.390.000 ₫,Voucher giảm  50%,5.0,3,Hà Nội,Trimei Zhenpin,SOYES,2780000,True,https://www.lazada.vn/products/pdp-i2655190806.html
"2023 S23 Ultra Điện thoại di động 6,7 inch Smartphone Pin 6800 mAh thông minh Miễn phí vận chuyển COD",2412694328,https://sg-test-11.slatic.net/p/0fdffe46821c2f46027475ddf9c61928.jpg,1.325.998 ₫,Voucher giảm  50%,,,Hà Nội,tiệm 3C,No Brand,2651996,True,https://www.lazada.vn/products/pdp-i2412694328.html
điện thoại di động giá rẻ S23 Ultra Bán di động ban đầu điện thoại mới ra 16+1T Bán điện thoại di động chính hãng Inch không thấm nước điện thoại di động đt giá học sinh,2616604811,https://vn-live-01.slatic.net/p/0ce463000437e6c728bbcfc794dae886.jpg,1.321.500 ₫,Voucher giảm  50%,,,Hà Nội,Chỉ vì 3C,No Brand,2643000,True,https://www.lazada.vn/products/pdp-i2616604811.html
đánh mọi gaming nặng chất Giao hàng nhận tiền 6.7inch Điện thoại di động Camera 48+24MP điện thoại trung quốc Mạng 5G điện thoại giá rẽ Pin Lớn 6000mAh điện thoại thông minh Hỗ trợ 2 SIMđiện thoại tồn kho mướt,3167195536,https://sg-test-11.slatic.net/p/3fe4ade6c53e32886864424f505e9a60.jpg,1.451.679 ₫,Voucher giảm  42%,,,Hà Nội,ysa6r589,No Brand,2502895,True,https://www.lazada.vn/products/pdp-i3167195536.html
"Điện thoại OPPO A3i 5G (6GB/128GB) Chip Dimensity 6300, Màn hình 120Hz,Rom tiếng việt - Hàng nhập khẩu",3105709571,https://vn-live-01.slatic.net/p/975705eac8c2e4b95d81b7ef08064a54.jpg,3.199.000 ₫,Voucher giảm  13%,5.0,3,Nghệ An,THẮNG THAO MOBILE,OPPO,3690000,True,https://www.lazada.vn/products/pdp-i3105709571.html
"[SALE- RẺ HỦY DIỆT ] Điện thoại 4G giá rẻ Samsung Galaxy A50s 2sim ram 4G/64G, Cấu hình Cao Chiến mọi Game mượt, Chụp ảnh đẹp, máy đủ màuSSMM",2918975032,https://vn-live-01.slatic.net/p/c856e4ac1664c246b51ceec3df3a91f8.jpg,279.000 ₫,,4.940298507462686,67,Hồ Chí Minh,MYSON MOBILE,Samsung,,True,https://www.lazada.vn/products/pdp-i2918975032.html
"Điện thoại di động Galaxy S23 Ultra mới giảm giá lớn 7,5 inch 12GB RAM + 512GB ROM Android 11.0 7800mAh pin lớn wifi bluetooth 5g điện thoại thông minh học trực tuyến",2527663295,https://sg-test-11.slatic.net/p/f767cb817a13b07d9a029a7f28620a0e.jpg,1.360.699 ₫,Voucher giảm  49%,,,Hà Nội,điện tử kỹ thuật số 3C,SOYES,2646200,True,https://www.lazada.vn/products/pdp-i2527663295.html
Điện Thoại Di Động Honor X6c 6GB + 128GB/256GB | Pin 5300mAh | Camera 50MP| NFC | Kháng nước IP64 | BH 18 Tháng,3148005522,https://vn-live-01.slatic.net/p/ab7050da1719febd401eda2964a4ccc6.png,4.490.000 ₫,,5.0,2,Long An,HONOR Vietnam,Honor,4990000,True,https://www.lazada.vn/products/pdp-i3148005522.html
Điện thoại di động hoàn toàn mới oqqo Reno9 HD6.7 inch điện thoại thông minh điện thoại di động,3175098656,https://vn-live-01.slatic.net/p/7c10340464a97cc33e6418f287f92253.jpg,1.340.000 ₫,Voucher giảm  50%,,,Hà Nội,điện tử kỹ thuật số 3C,SOYES,2680000,True,https://www.lazada.vn/products/pdp-i3175098656.html
Điện thoại di động S23 Pro Deal Điện Tử Giảm Đến 50% Android mới 16+512 GB Bán Giá rẻ săn sele máy mới smartphone,2614829868,https://vn-live-01.slatic.net/p/065a8e13951311f8ded1e319494cd0ab.png,1.338.800 ₫,Voucher giảm  50%,,,Hà Nội,Trimei Zhenpin,No Brand,2677600,True,https://www.lazada.vn/products/pdp-i2614829868.html
"Samsung Galaxy J6 - Smartphone tầm trung, thiết kế đẹp, hiệu năng tốt",2621756279,https://filebroker-cdn.lazada.sg/kf/Sc309644e18f048068050f1ab52a52b6b6.png,353.780 ₫,Voucher giảm  53%,5.0,2,Hà Nội,Smartchoice 247,Samsung,760000,True,https://www.lazada.vn/products/pdp-i2621756279.html
Giá Siêu Rẻ S23 Ultra Di Động Chính 6.8Inch Điện Thoại 16+1TB Hai Thẻ Sim Camera 48+72MP Pin 6800mAh Ai Pat Giá Rẻ,2666314381,https://vn-live-01.slatic.net/p/974da76543aa1eece81125311865e177.jpg,1.321.000 ₫,Voucher giảm  50%,,,Hà Nội,Siêu thị 3C giá rẻ,No Brand,2642000,True,https://www.lazada.vn/products/pdp-i2666314381.html
ĐIện thoại chính hãng Samsung Galaxy J4 Plus màn to giá rẻ hỗ trợ 4G LTE Máy Cũ Tân Trang Đẹp,3065969434,https://vn-live-01.slatic.net/p/1bbef2c39f421ed572405e75e735df89.jpg,402.000 ₫,"LazFlash Sale,kết thúc sau 2 ngày",4.62962962962963,27,Hà Nội,Smartchoice 247,Samsung,900000,True,https://www.lazada.vn/products/pdp-i3065969434.html
Điện Thoại Thông Minh Giá Rẻ Galaxy S23 Ultra Mới Điện Thoại Di Động 6.8inch 8+256GB Giá Rẻ 4G/5G Tiết Kiệm Chi Phí Có Thể Lướt Internet,2628004828,https://vn-live-01.slatic.net/p/c031ef3ae8a4f3336cef42cacabba399.jpg,1.190.000 ₫,Voucher giảm  49%,5.0,1,Hà Nội,điện tử kỹ thuật số 3C,No Brand,2320000,True,https://www.lazada.vn/products/pdp-i2628004828.html
S23 Ultra Mobile Phone 7.5 -inch bản gốc mới 512GB ROM +16GB RAM 5G Điện thoại di động Thẻ thông minh Dual Card di động lớn Điện thoại di động Điện thoại di động,2599359541,https://sg-test-11.slatic.net/p/757d3344943414d1558fb0b04511cf77.jpg,1.331.549 ₫,Voucher giảm  50%,,,Hà Nội,Trimei Zhenpin,SOYES,2654299,True,https://www.lazada.vn/products/pdp-i2599359541.html
"[COD] Điện thoại di động chính hãng S23 Ultra 5G Điện thoại di động giá rẻ 7,5 inch 16GB + 512GB hai SIM ở chế độ chờ kép 6800mAh Điện thoại thông minh Android giá rẻ bán giải phóng mặt bằng điện thoại di động",2543637519,https://sg-test-11.slatic.net/p/835002d87856cd146d81fed546240433.jpg,1.359.999 ₫,Voucher giảm  49%,,,Hà Nội,Trimei Zhenpin,SOYES,2654299,True,https://www.lazada.vn/products/pdp-i2543637519.html
Điện thoại Xiaomi Mi 11 Lite 5G Ram 8GB bộ nhớ 128GB chính hãng full chức năng_MBMS,2880131373,https://vn-live-01.slatic.net/p/b80a2fb6a3805e8217b44b4e0154fc56.jpg,267.000 ₫,Voucher giảm  35%,4.791666666666667,72,Hồ Chí Minh,MYSON MOBILE,Xiaomi,409000,True,https://www.lazada.vn/products/pdp-i2880131373.html
điện thoại Samsunq J7 prime 2sim ram 3G bộ nhớ trong 32GB nguyên zin đẹp keng,2793848047,https://vn-live-01.slatic.net/p/ed2516b73da91b0c87a55dbf0bb08c55.jpg,603.911 ₫,"LazFlash Sale,kết thúc sau 7h",4.884615384615385,78,Hồ Chí Minh,Nguyên Lê Store,No Brand,1460000,True,https://www.lazada.vn/products/pdp-i2793848047.html
Điện thoại 2 sim hỗ trợ 4G,2877276991,https://filebroker-cdn.lazada.vn/kf/S8447a2bf91f84612976646f470f4819cP.jpg,155.000 ₫,,5.0,1,Bình Dương,Cummayfull,No Brand,,True,https://www.lazada.vn/products/pdp-i2877276991.html
"[ RẺ VÔ ĐỊCH ] điện thoại 4G Samsung Galaxy S7 Edge ram 4G/32G Chính Hãng, Chiến Game mượt, Chụp ảnh siêu đẹp - BBCMS",2881520195,https://vn-live-01.slatic.net/p/b64dd683c4f42b362500bf45e0f2c215.jpg,278.000 ₫,Voucher giảm  30%,4.809523809523809,21,Hồ Chí Minh,MYSON MOBILE,Samsung,398000,True,https://www.lazada.vn/products/pdp-i2881520195.html
Điện thoại Samsung J7prime sóng 4G 2sim.Loa to sóng khỏe. BẢO HÀNH 6 THÁNG. 1 ĐỔI 1 TRONG 2 THÁNG,2437150867,https://vn-live-01.slatic.net/p/c507a864b97053b85f32ab3e3515db96.jpg,395.000 ₫,,5.0,11,Hải Dương,Shop Điện Thoại 9191,Samsung,,True,https://www.lazada.vn/products/pdp-i2437150867.html
Điện thoại Realme C2 2SIM Cấu hình Ram 2/32G Màn hình tràn viền Pin Trâu,3051561753,https://vn-live-01.slatic.net/p/e2cf29b6947eb9f52be54464d0267127.jpg,678.699 ₫,Voucher giảm  52%,4.975,40,Hồ Chí Minh,Nguyên Lê Store,Motorola,1400000,True,https://www.lazada.vn/products/pdp-i3051561753.html
"Điện thoại người già H11 Sóng 4G 2 Sim loa to, Pin cực trâu 6800mAh - Bảo hành 3 Tháng",3043124968,https://vn-live-01.slatic.net/p/646b73353f254fe11db5260a76667ad1.jpg,289.000 ₫,Voucher giảm  47%,5.0,2,Hồ Chí Minh,Ngọc Xuân Mobile,CC,550000,True,https://www.lazada.vn/products/pdp-i3043124968.html
Điện thoại phổ thông Cấu hình mạnh đỉnh đt giá rẻ chính hãng Sạc nhanh Điện thoại di động Hàng mới về Giao hàng nhận tiền siêu mượt giá rẻ học sinh,3084023074,https://sg-test-11.slatic.net/p/5e58d54b2a2096b8f83b89127268ccdd.jpg,1.040.998 ₫,Voucher giảm  46%,,,Hà Nội,O้racl1e021,No Brand,1927774,True,https://www.lazada.vn/products/pdp-i3084023074.html
"Điện thoại 6300 4G ,Màn hình 2.4inch,pin 1500mAh - Mới Fullbox",3087532746,https://vn-live-01.slatic.net/p/83a03b3dbc6d6f81a037802968fac693.jpg,490.000 ₫,Voucher giảm  29%,5.0,2,Nghệ An,THẮNG THAO MOBILE,Nokia,690000,True,https://www.lazada.vn/products/pdp-i3087532746.html
Điện thoại Samsung Galaxy A06 - Hàng chính hãng,2948306991,https://vn-live-01.slatic.net/p/d3623f42d38c466aa92a658b07a51ae9.png,2.150.000 ₫,,5.0,91,Hồ Chí Minh,iStone Store,Samsung,3190000,True,https://www.lazada.vn/products/pdp-i2948306991.html
"Điện thoại di động chắc chắn Oukitel WP32 Pro, RAM 24Gb(6GB + 18GB),ROM 256GB,Màn hình 6 inch HD,camera 20MP, NFC)",3186819809,https://vn-live-01.slatic.net/p/7815f21471dd53881e9a9de81d034cb4.jpg,1.000.000 ₫,Voucher giảm  50%,,,Đà Nẵng,Minh Quân Mobile 1,No Brand,2000000,True,https://www.lazada.vn/products/pdp-i3186819809.html
BDF M3PRO 8GB/256GB Global Phiên bản 5G Điện thoại thông minh 48MP Camera 67W Sạc điện thoại di động 144Hz,2220789765,https://my-live-01.slatic.net/p/30a41acaa769e8869aadca35280632d6.jpg,930.000 ₫,,5.0,1,China,BDF Tablet PC,BDF,1860000,True,https://www.lazada.vn/products/pdp-i2220789765.html
"[ RẺ HỦY DIỆT ] điện thoại 4G Samsung Galaxy Note 9 ram 6G/128G Chính Hãng, Chiến Game mượt, Chụp ảnh siêu đẹp - CMS",2880763715,https://vn-live-01.slatic.net/p/1cd3cf94df0c1f759c36e5a02fac0e6b.jpg,1.139.000 ₫,Voucher giảm  37%,5.0,22,Hồ Chí Minh,MYSON MOBILE,Samsung,1799000,True,https://www.lazada.vn/products/pdp-i2880763715.html
Điện thoại Samsung galaxy A31 Ram 6G bộ nhớ 128GB  máy zin chính hãng full chức năng,2531333864,https://vn-live-01.slatic.net/p/a4fffa91cb5ffdca6d00c980a321f5e3.jpg,1.294.090 ₫,Voucher giảm  19%,5.0,3,Hồ Chí Minh,Di Động Khmer Sài Gòn,No Brand,1590000,True,https://www.lazada.vn/products/pdp-i2531333864.html
"&lt; GIẢM GIÁ HÓT &gt; ""điện thoại chính hãng giá rẻ Samsung galaxy A10 ( Samsung a10 ) 2sim ram 2G/16G Chính Hãng, Cày Game nặng siêu mượt, full mọi chức năng ,tặng sạc cáp ốp lưng ,bảo hành 12 tháng",2018121695,https://vn-live-01.slatic.net/p/16f63882f054f620e37ea92c5a07e594.jpg,720.000 ₫,Voucher giảm  42%,5.0,15,Hồ Chí Minh, shop thúy diễm ,Samsung,1250000,True,https://www.lazada.vn/products/pdp-i2018121695.html
Điện thoại Xiaomi Qin F22 (No Camera),2432316020,https://filebroker-cdn.lazada.vn/kf/Sd5402cf34d1c4de98667d0235a63aeb5J.jpg,1.790.000 ₫,,5.0,6,Hà Nội,QIN Phone Store,Xiaomi,,True,https://www.lazada.vn/products/pdp-i2432316020.html
SERVO Ultra700 Qwerty Điện Thoại Di Động 4 Thẻ SIM Danh Sách Đen Quay Số Tốc Độ NFC Kiểm Soát Truy Cập GSM Di Động Bàn Phím Đầy Đủ Thiết Kế Type-C,2945790367,https://filebroker-cdn.lazada.vn/kf/S1baddfb9831b4b808ac01ea0513fb6e4d.jpg,721.000 ₫,Mua 4 được Giảm 35%,4.666666666666667,12,China,GlobalLifestyle,SERVO,938000,True,https://www.lazada.vn/products/pdp-i2945790367.html
Điện thoại Samsung Galaxy A7 (2018) Máy Cũ Tân Trang,3066145005,https://vn-live-01.slatic.net/p/50669defcef910475e96d2dbf037cb02.png,925.414 ₫,Voucher giảm  53%,5.0,1,Hà Nội,Smartchoice 247,Samsung,1988000,True,https://www.lazada.vn/products/pdp-i3066145005.html
Vivo Y50 Smartphone 8GB RAM 128GB Storage Snapdragon 665 Octa Core 6.35 inch Display High Battery,3030055996,https://vn-live-01.slatic.net/p/269f46556fc81a33fdc16628888d139b.jpg,1.255.000 ₫,Voucher giảm  37%,4.68,25,Hồ Chí Minh,Phone Mai Mobile,Vivo,1990000,True,https://www.lazada.vn/products/pdp-i3030055996.html
điện thoại giá rẽ đánh mọi gaming nặng chất Cellphones Vi xử lý 10 nhân điện thoại cảm ứng Bộ nhớ 16+1TB Điện Thoại Thông Minh Màn hình AMOLED Smartphone Hỗ trợ tiếng Việt trênmới nguyên bản Mướt game Điện thoại di,3121146505,https://vn-live-01.slatic.net/p/0eb4ccb97e4cb5da32cea55372ca88c6.jpg,1.036.661 ₫,Voucher giảm  42%,,,Hà Nội,O้racl1e021,No Brand,1774698,True,https://www.lazada.vn/products/pdp-i3121146505.html
điện thoại rẻ cho học sinh đánh mọi gaming nặng chất Bán giá rẻ Hàng mới về điện thoại cảm ứng giá rẻ 7.3inch Android Mobile Bộ nhớ 16+1TB dt giá rẻ,3090738233,https://sg-test-11.slatic.net/p/2169cc91f93549d328cb3f5556c3add3.jpg,1.036.072 ₫,Voucher giảm  42%,5.0,1,Hà Nội,ysa6r589,K-TOUCH,1784154,True,https://www.lazada.vn/products/pdp-i3090738233.html
SAMSUNG Galaxy A51 RAM 6GB/128GB Máy đẹp có NFC,2643638569,https://filebroker-cdn.lazada.vn/kf/S31fdc46c30de435e86f07eb31dc9c1a7Y.jpg,1.230.000 ₫,Voucher giảm  32%,4.5,10,Bạc Liêu,Điện Thoại 2T,Samsung,1800000,True,https://www.lazada.vn/products/pdp-i2643638569.html
Điện thoại Samsung galaxy A03 Ram 4G bộ nhớ 64GB máy zin chính hãng full chức năng,2540039028,https://filebroker-cdn.lazada.vn/kf/Saf025fb37ed846b4b0e37ab52d0865fc7.jpg,1.290.000 ₫,Voucher giảm  13%,,,Hồ Chí Minh,Di Động Khmer Sài Gòn,No Brand,1490000,True,https://www.lazada.vn/products/pdp-i2540039028.html
SAMSUNG A30 RAM 4GB/64GB Máy đẹp dùng mượt,2672450529,https://filebroker-cdn.lazada.vn/kf/See9fc6dee12b4d8fac88287c33efa7a3x.jpg,750.000 ₫,Voucher giảm  40%,4.717391304347826,46,Bạc Liêu,Điện Thoại 2T,Samsung,1250000,True,https://www.lazada.vn/products/pdp-i2672450529.html
Xiaomi Redmi note 12 Ram 8GB/128GB pin 5000 mAh máy chính hãng Vân tay Ok,2995168878,https://vn-live-01.slatic.net/p/890c41af91e65cfa31a6fec5347e3820.jpg,2.024.000 ₫,Voucher giảm  8%,5.0,3,Bạc Liêu,ĐIỆN THOẠI GIÁ MỀM 79,Xiaomi,2200000,True,https://www.lazada.vn/products/pdp-i2995168878.html
Điện thoại Huawei Y9 Prime Ram 4G bộ nhớ 128GB máy zin đẹp 99% có google chplay,2526900247,https://vn-live-01.slatic.net/p/7feacefa49e57fe48dda7253c41745e0.jpg,1.480.290 ₫,Voucher giảm  20%,5.0,2,Hồ Chí Minh,Di Động Khmer Sài Gòn,No Brand,1850000,True,https://www.lazada.vn/products/pdp-i2526900247.html
giá rẻ học sinh S23 Ultra đầu điện thoại mới ra 3+32GB Máy ảnh HD 7.3Inch Máy ảnh Pin 6800mAh Hai Thẻ Sim Camera HD 32+64MP rẻ cho học sinh dt giá rẻ chính hãng,2598706763,https://vn-live-01.slatic.net/p/c5976e67d9433fcde5ab90da151a5469.jpg,1.178.000 ₫,Voucher giảm  48%,,,Hà Nội,điện tử kỹ thuật số 3C,No Brand,2260000,True,https://www.lazada.vn/products/pdp-i2598706763.html
Điện thoại Redmi10 Ram 6GB bộ nhớ 128GB máy chính hãng tặng kèm ốp lưng,2321699091,https://vn-live-01.slatic.net/p/bf160c0a3f819655285895ee039ef111.jpg,1.573.390 ₫,Voucher giảm  13%,5.0,2,Hồ Chí Minh,Di Động Khmer Sài Gòn,No Brand,1800000,True,https://www.lazada.vn/products/pdp-i2321699091.html
Điện thoại Redmi Note 9 Ram 4G bộ nhớ 64GB máy zin đẹp mới 99% kèm ốp lưng,2321592583,https://vn-live-01.slatic.net/p/3c192d855dd254f5dea9b5d231eb3523.jpg,1.387.190 ₫,Voucher giảm  13%,5.0,2,Hồ Chí Minh,Di Động Khmer Sài Gòn,No Brand,1590000,True,https://www.lazada.vn/products/pdp-i2321592583.html
Điện thoại giá tốt Samsung Galaxy Note 10 ram 8G/256G Cấu hình Cao Chiến mọi Game mượt Chụp ảnh đẹp - smartphone,2938517332,https://vn-live-01.slatic.net/p/04837cb5c36c045b85f0b99aa20ed64b.jpg,2.484.000 ₫,Voucher giảm  8%,4.0,5,Bạc Liêu,ĐIỆN THOẠI GIÁ MỀM 79,Samsung,2700000,True,https://www.lazada.vn/products/pdp-i2938517332.html
đien thoại giá rẻ nhất Màn hình AMOLED Bán giá rẻ Cấu hình mạnh đỉnh điện thoại chơi game đánh mọi gaming nặng chất Tiếng Việtmướt game Mới 100%,3090624355,https://sg-test-11.slatic.net/p/243b7e51c9fe6513cadfbaa943a30dd3.jpg,1.019.618 ₫,Voucher giảm  43%,5.0,1,Hà Nội,ysa6r589,Amoi,1785324,True,https://www.lazada.vn/products/pdp-i3090624355.html
Samsung A20 RAM 3GB/32GB,2672449481,https://filebroker-cdn.lazada.vn/kf/S5b80516565ae4c5da2a3f24601d1ab27k.jpg,730.000 ₫,Voucher giảm  39%,4.8,20,Bạc Liêu,Điện Thoại 2T,Samsung,1200000,True,https://www.lazada.vn/products/pdp-i2672449481.html
Samsung A750 RAM 6G/128G dùng mượt,2634788092,https://filebroker-cdn.lazada.vn/kf/S2dde05f5751c488f8c5f635b6c17064dN.jpg,820.000 ₫,Voucher giảm  39%,4.7272727272727275,44,Bạc Liêu,Điện Thoại 2T,Samsung,1350000,True,https://www.lazada.vn/products/pdp-i2634788092.html
