name,nid,image,priceShow,voucher,ratingScore,review,location,sellerName,brandName,originalPrice,inStock,itemUrl
Samsung galaxy A23 Ram 4GB bộ nhớ 128GB máy zin đẹp 99 full chức năng kèm full phụ kiện,2890413107,https://vn-live-01.slatic.net/p/d2bca6c6509f59b7c0a65cae88dc815b.jpg,1.666.490 ₫,Voucher giảm  12%,5.0,1,Hồ Chí Minh,Di Động Khmer Sài Gòn,No Brand,1890000,True,https://www.lazada.vn/products/pdp-i2890413107.html
"SERVO A50 PRO Có Thể Gập Lại GSM Mở Khóa Điện Thoại Di Động Dual SIM 2.4 ""Type-C Điện Thoại Di Động Tự Động Đài FM Ghi Âm Cuộc Gọi Số Tốc Độ Giọng Nói Ma Thuật",2580946999,https://filebroker-cdn.lazada.vn/kf/S552715ebb6894a5284a3b40a93312b98H.jpg,638.000 ₫,Mua 4 được Giảm 35%,4.026315789473684,78,China,Global Joy,No Brand,829000,True,https://www.lazada.vn/products/pdp-i2580946999.html
Dien Thoại Di Động S23 Ultra 7.3Inch Thông Minh 12+512GB Android Giá Rẻ Hỗ Trợ Bluetooth Sim Kép Pin 6800mAh,2667489275,https://vn-live-01.slatic.net/p/e5b66d4ce603f0cefd63b69d1c411aca.jpg,1.248.000 ₫,Voucher giảm  50%,,,Hà Nội,điện tử kỹ thuật số 3C,No Brand,2496000,True,https://www.lazada.vn/products/pdp-i2667489275.html
2023 Điên Thoại S23 Ultra Di Động Chính Hãng 7.3Inch Điện Thoại 8+256GB Thẻ Sim Camera 50+108MP Pin 6800mAh Điện Thoại Ai Pat Giá Rẻ,2633430668,https://vn-live-01.slatic.net/p/f0cd402a188adfee29438c1382c316d0.jpg,1.248.800 ₫,Voucher giảm  50%,1.0,1,Hà Nội,điện tử kỹ thuật số 3C,No Brand,2496000,True,https://www.lazada.vn/products/pdp-i2633430668.html
Điện thoại Xiaomi Mi 11 Lite 5G Rom Quốc tế tiếng Việt - Snapdragon 780G ram 8G 128G,2160082267,https://vn-live-01.slatic.net/p/38f0e42163ace1eb872ac0d3699804f1.jpg_1500x1500q80.jpg,2.828.000 ₫,Voucher giảm  42%,4.590909090909091,22,Nghệ An,TheLinhStore,Xiaomi,4868000,True,https://www.lazada.vn/products/pdp-i2160082267.html
"Điện Thoại Sharp Aqous R SHV39 - Chip 835, Ram 4gb, Bộ Nhớ 64GB",676662125,https://vn-live-01.slatic.net/p/e9293328a34b3ca871bac6adfc3c4535.jpg,999.000 ₫,,4.8125,32,Hà Nội,Japan Mobile,Sharp,,True,https://www.lazada.vn/products/pdp-i676662125.html
"Xiaomi Qin F22 Pro New Fullbox Quốc Tế - Sẵn cửa hàng CH Play, Full Tiếng Việt bàn phím cứng T9 tiếng việt như Nokia",2385823081,https://vn-live-01.slatic.net/p/636eba05f0138c37d9f0aa66e66c366e.jpg,3.150.000 ₫,Voucher giảm  21%,4.428571428571429,14,Hải Phòng,Xiaomi Qin Việt Nam,Xiaomi,3990000,True,https://www.lazada.vn/products/pdp-i2385823081.html
"[ RẺ VÔ ĐỊCH ] điện thoại 4G Samsung Galaxy S7 Edge 2sim ram 4G/32G Chính Hãng Chiến Game mượt, Chụp ảnh siêu đẹp - máy đủ màu CMSS",2881533173,https://vn-live-01.slatic.net/p/96533d22d5d91a37788cdc3bdb0cdf19.jpg,278.000 ₫,Voucher giảm  9%,4.2,30,Hồ Chí Minh,MYSON MOBILE,Samsung,307000,True,https://www.lazada.vn/products/pdp-i2881533173.html
2024 New S24 Ultra điện thoại thông minh 7.3 inch Android 3G/4G/5G giá rẻ 12GB/512GB 8000mAh điện thoại rẻ cho học sinh Hai SIM Với bút,2925058611,https://vn-live-01.slatic.net/p/b2c4ab0e25ef940a7cde8d7c8bfa498a.jpg,1.488.377 ₫,Voucher giảm  53%,3.9130434782608696,23,Hà Nội,Siêu thị 3C giá rẻ,SOYES,3196000,True,https://www.lazada.vn/products/pdp-i2925058611.html
điện thoại X4 GT giá rẻ 7.2inch đt giá học sinh Bộ nhớ 16+1TB điên thoại giá học sinh Camera108+72MP đt giá siêu rẻ pin trâu 6800mAh Android Điện thoại di động,2952756003,https://vn-live-01.slatic.net/p/ee97f4e86f08ac959577f48169092372.jpg,1.109.096 ₫,Voucher giảm  41%,,,Hà Nội,O้racl1e021,No Brand,1879824,True,https://www.lazada.vn/products/pdp-i2952756003.html
"điện thoại VlV0 Y17- 2Sim ram 8G/256G, Pin 5000mah, Camera sắc nét, Chiến Game Nặng mượt",3172002485,https://vn-live-01.slatic.net/p/d865ed3d65538c55b9ac8d73bff4b5be.jpg,1.145.000 ₫,Voucher giảm  34%,5.0,6,Đăk Lăk,HOANG MOBILE 47,No Brand,1745000,True,https://www.lazada.vn/products/pdp-i3172002485.html
"Xiaomi Redmi 13C 5G Smartphone 8GB RAM 256GB ROM Dual Rear Cameras 50MP 6.74"" IPS LCD Helio G85 Battery 5000mAh Fast Charging - Official Store",3066868573,https://vn-live-01.slatic.net/p/c17a6f70a2a86de13990d8fb31296d90.png,2.399.000 ₫,Voucher giảm  45%,4.813559322033898,58,Hà Nội,Rex.Home,Redmi,4399000,True,https://www.lazada.vn/products/pdp-i3066868573.html
"Điện thoại thông minh 2024 S24 Ultra| Android 7,3 inch, 3G / 4G / 5G, Giá cả phải chăng 6GB / 128GB, Màn hình Full HD, SIM kép, Stylus, GPS, Thân thiện với sinh viên",2938613797,https://vn-live-01.slatic.net/p/bf8b40b692e7ef8f57c4bfbaebf837b3.png,1.596.672 ₫,Voucher giảm  53%,,,Hà Nội,Siêu thị 3C giá rẻ,SOYES,3430016,True,https://www.lazada.vn/products/pdp-i2938613797.html
điện thoại 0PP0 A53 (8/256GB) |Cấu hình Cao Chiến mọi Game mượt - Hàng chính hãng Bảo hành 12 tháng,3172054823,https://vn-live-01.slatic.net/p/e29f0617d0e8a0d0a52291811769508c.jpg,1.445.000 ₫,Voucher giảm  36%,5.0,3,Đăk Lăk,HOANG MOBILE 47,No Brand,2245000,True,https://www.lazada.vn/products/pdp-i3172054823.html
Điện thoại Mướt Game Bộ nhớ 16+512GB Điện thoại di động Cấu hình mạnh đỉnh giá bán rẻ Sạc nhanh đt giá rẻ cho hs Android Chính Hãng điện thoại giá rẻ,3082229188,https://vn-live-01.slatic.net/p/47e35019c42612c5a0475e83e38fad1c.jpg,1.117.383 ₫,Voucher giảm  42%,3.0,2,Hà Nội,Pzi5i125,No Brand,1915994,True,https://www.lazada.vn/products/pdp-i3082229188.html
Samsung A70 RAM 6GB/128GB Chip Snapdragon,2823257979,https://filebroker-cdn.lazada.vn/kf/S46e01d260c0c4e548830db22301b64ea9.jpg,1.225.000 ₫,Voucher giảm  32%,5.0,5,Bạc Liêu,Điện Thoại 2T,Samsung,1800000,True,https://www.lazada.vn/products/pdp-i2823257979.html
Điện Thoại Samsung Galaxy A06 5G 6GB/128GB,3059799002,https://filebroker-cdn.lazada.vn/kf/S37837a574ebe4423a16d05bb49c67a5dp.jpg,3.299.000 ₫,,4.967741935483871,93,Hồ Chí Minh,Samsung Store,Samsung,4490000,True,https://www.lazada.vn/products/pdp-i3059799002.html
Xiaomi 10pro Redmi K30pro Power Ic Baseus Sdx55m Snapdragon 865 Sm8250 Cpu Lưới Hàn Điện Thoại Di Động Thành Phần,2830494368,https://filebroker-cdn.lazada.vn/kf/S34585e6c70ca4ed89c11980cb11f276fV.jpg,84.000 ₫,,,,Hong Kong,TB EL SHOP,No Brand,,True,https://www.lazada.vn/products/pdp-i2830494368.html
điện thoại giá siêu rẻ S23 Ultra mới 100% 7.3Inch thông minh 3+32GB bộ nhớ lớn di động máy CHÍNH HÃNG Vô cực mượt Chơi Game nặng mướt Chơi,2623336689,https://vn-live-01.slatic.net/p/479e9edd74bd4dd2bd94a13c198930e5.jpg,1.148.990 ₫,Voucher giảm  45%,,,Hà Nội,điện tử kỹ thuật số 3C,No Brand,2077980,True,https://www.lazada.vn/products/pdp-i2623336689.html
"AliExpress Bùng Nổ Điện Thoại Di Động Xuyên Biên Giới S24ultra 1 16g6, 8 Inch Điện Thoại Thông Minh Tất Cả Trong Một Nhà Máy Nguồn",3058354646,https://vn-live-01.slatic.net/p/d177f25dc306ee9db6e46058975ddd93.jpg_webp,1.014.393 ₫,Voucher giảm  20%,,,Lào Cai,Towns kỹ thuật số,No Brand,1267992,True,https://www.lazada.vn/products/pdp-i3058354646.html
Điện thoại thông minh REDMI Note 14 (6+128GB | 8+128G | 8+256G) | Camera AI 108MP | MediaTek Helio G99-Ultra | Pin 5500mAh,3014255425,https://vn-live-01.slatic.net/p/153a7c2ee743613e32de684fea4d4fc1.jpg,4.790.000 ₫,,4.9489051094890515,137,Bình Dương,Xiaomi Official Store,Redmi,4990000,True,https://www.lazada.vn/products/pdp-i3014255425.html
Điện thoại Samsung Note 10 Plus Mỹ 1 sim ram 12/256 Snap 855,2620726802,https://vn-live-01.slatic.net/p/df80e969f3c977f08321c3599fec7390.png,3.898.000 ₫,Voucher giảm  15%,,,Hồ Chí Minh,Di Động 68 HCM,Samsung,4598000,True,https://www.lazada.vn/products/pdp-i2620726802.html
điện thoại chính hãng giá rẻ S23 Ultra Di Động Chính Hãng 7.3Inch Điện Thoại Di Động Bộ Nhớ Lớn 16+512GB Hai Thẻ Sim Camera 32+64MP Pin 6800mAh Điện thoại thông minh,2483735945,https://vn-live-01.slatic.net/p/6744da8aa00a25d4e027eec7cec251a6.jpg,1.276.880 ₫,Voucher giảm  50%,,,Hà Nội,Chỉ vì 3C,No Brand,2553760,True,https://www.lazada.vn/products/pdp-i2483735945.html
Điện thoại Xiaomi Redmi 13 (6GB/128GB) - Chính Hãng,2484389320,https://vn-live-01.slatic.net/p/665a1b041bad66981ec9a82627d2c57d.jpg,2.890.000 ₫,Voucher giảm  33%,4.994623655913978,372,Hà Nội,Hoàng Hà Mobile,Xiaomi,4290000,True,https://www.lazada.vn/products/pdp-i2484389320.html
"&lt; TRỢ GIÁ RẺ &gt; Điện thoại chính hãng Samsung galaxy A30S Ram 4/64Gb ,Máy mới leng keng ,Cấu hình mạnh cân mọi game nặng ,lướt wed xem fim tiktok zalo fb thoải mái ,máy được bảo hành 12 tháng",2154532236,https://filebroker-cdn.lazada.vn/kf/S45aff5996cea495b8dc762907d1434f6S.jpg,1.186.000 ₫,Voucher giảm  39%,5.0,11,Hồ Chí Minh, shop thúy diễm ,Samsung,1950000,True,https://www.lazada.vn/products/pdp-i2154532236.html
Điện Thoại Di Động S23 Ultra Chính Hãng 7.3Inch Bộ Nhớ Lớn 16+512GB Hai Thẻ Sim Camera HD 32+64MP Pin 6800mAh Điện Thoại Trung Quốc,2656663943,https://vn-live-01.slatic.net/p/6b0aedb28627f6444b06a9da56113cca.jpg,1.216.500 ₫,Voucher giảm  50%,,,Hà Nội,điện tử kỹ thuật số 3C,No Brand,2433000,True,https://www.lazada.vn/products/pdp-i2656663943.html
Điện thoại cao cấp đánh mọi gaming nặng chất đt giá rẻ cho hs Camera 48/24MP điện thoại giá siêu rẻ Sạc nhanh Feature phones Cấu hình mạnh đỉnh,3045905809,https://sg-test-11.slatic.net/p/135d6f63433c336b184df804a56ae789.jpg,1.005.856 ₫,Voucher giảm  46%,,,Hà Nội,Pzi5i125,No Brand,1855029,True,https://www.lazada.vn/products/pdp-i3045905809.html
Điện thoại di động HTC Wildfire E3 lite (4GB/64GB) - Chính hãng,2435617043,https://vn-live-01.slatic.net/p/df7cfbf62969889ae4a1461ca23d3292.png,1.750.000 ₫,Voucher giảm  41%,4.565217391304348,23,Hồ Chí Minh,Hoàng Hà Mobile,HTC,2990000,True,https://www.lazada.vn/products/pdp-i2435617043.html
sở hữu Điện thoại S23 Ultra mới 100% Android 6.8inch 2 SIM Cuộc gọi Chơi trò chơi thông minh 16+512GB máy CHÍNH HÃNG Vô cực  nặng mướt Chơi Game,2601959261,https://vn-live-01.slatic.net/p/2f9c9e26813b83ed2e513a6882b690f3.jpg,1.286.900 ₫,Voucher giảm  50%,,,Hà Nội,điện tử kỹ thuật số 3C,No Brand,2558000,True,https://www.lazada.vn/products/pdp-i2601959261.html
Điện Thoại Di Động chính hãngS22 Ultra Điện Thoại Di Động Màn Hình Full HD 6.8Inch Bộ Nhớ 3+32GB Hai Thẻ Sim Camera HD Pin 6000mAh chính hãng giá rẻ,2372834033,https://vn-live-01.slatic.net/p/e53fb02d446679694e998454f2417987.jpg,1.183.900 ₫,Voucher giảm  48%,,,Hà Nội,điện tử kỹ thuật số 3C,No Brand,2265800,True,https://www.lazada.vn/products/pdp-i2372834033.html
"Điện thoại thông minh REDMI 13 (6+128G | 8+128G) | Màn hình lớn 6.79"" FHD+ | Camera 108MP siêu rõ | MediaTek Helio G91-Ultra",3014249921,https://vn-live-01.slatic.net/p/0c28415c15cd5358f414fc4f81e1e765.jpg,2.990.000 ₫,,5.0,26,Bình Dương,Xiaomi Official Store,Redmi,4290000,True,https://www.lazada.vn/products/pdp-i3014249921.html
Newman 4G Màn Hình Kép Điện Thoại Di Động Lật Toàn Mạng Chờ Lâu Thiết Kế Thân Thiện Với Công Dân Cao Cấp Nhỏ Gọn Và Di Động,2879941383,https://filebroker-cdn.lazada.vn/kf/Sb57a050f8a744a9bb4bb7172d58a8694B.jpg,841.000 ₫,Mua 4 được Giảm 35%,4.0,12,Nước ngoài,GlobalWonderShop,No Brand,1093000,True,https://www.lazada.vn/products/pdp-i2879941383.html
dt giá rẻ đánh mọi gaming nặng chất điện thoại Hỗ trợ 4G/5G đt rẻ Màn hình AMOLED điện thoại việt nam Hỗ trợ kiểm tra hàng hóa Giao hàng nhận tiền,3063383164,https://sg-test-11.slatic.net/p/7af20b336bade65b81f4b3ecee53677d.jpg,945.789 ₫,Voucher giảm  42%,,,Hà Nội,O้racl1e021,No Brand,1621903,True,https://www.lazada.vn/products/pdp-i3063383164.html
Điên Thoại Di Động Giá Học Sinh S23 Ultra 7.3Inch Bộ Nhớ Lớn 6+128GB Camera 32+64MP Pin 6800mAh Điện Thoại Di Động Chính Hãng Giá Rẻ,2618732631,https://vn-live-01.slatic.net/p/f0e4c9d4e6c8799e432cb29534866f8e.jpg,1.197.900 ₫,Voucher giảm  49%,,,Hà Nội,điện tử kỹ thuật số 3C,No Brand,2335800,True,https://www.lazada.vn/products/pdp-i2618732631.html
Điện thoại di động mới Galaxy+ S23 Ultra 7.3 inch 2 SIM Smartphone 4G/5G thông minh Pin 6800mAh rẻ cho học sinh COD Android giá rẽ,2333686013,https://vn-live-01.slatic.net/p/03a384232e6635d4157adc8ae24cc18a.jpg,1.860.000 ₫,,,,Hà Nội,điện tử kỹ thuật số 3C,No Brand,,True,https://www.lazada.vn/products/pdp-i2333686013.html
Điện Thoại Samsung Galaxy A06 5G 4GB/128GB - Hàng Chính Hãng,3068980842,https://vn-live-01.slatic.net/p/eb1a07aca74171551bc78f20a30662df.jpg,2.776.000 ₫,,5.0,2,Bến Tre,Hồng Hạnh Mobile Mall,Samsung,4490000,True,https://www.lazada.vn/products/pdp-i3068980842.html
Điện thoại S23 Ultra 7.3Inch Di Động Chính Hãng 12+512GB di động máy CHÍNH HÃNG Vô cực mượt Chơi Game ai pat giá rẻ Deal Điện Tử Giảm Đến 50%,2417255429,https://vn-live-01.slatic.net/p/d41c1d23fe659a5f4e1e79754d8f68d4.jpg,1.288.560 ₫,Voucher giảm  50%,,,Hà Nội,Siêu thị 3C giá rẻ,No Brand,2576000,True,https://www.lazada.vn/products/pdp-i2417255429.html
đt rẻ Hỗ trợ kiểm tra hàng hóa Điện thoại di động Siêu CPU Đt Pin trâu 6800mAh điên thoại gia rẻ 7.3inch New Arrival,3169940164,https://sg-test-11.slatic.net/p/9efef7cf5fb2181cd221f6dadbc9dc7f.jpg,941.409 ₫,Voucher giảm  45%,,,Hà Nội,O้racl1e021,No Brand,1702026,True,https://www.lazada.vn/products/pdp-i3169940164.html
đt siêu rẻ Camera 72+48MP Điện Thoại Thông Minh Giao hàng nhận tiền Vi xử lý 10 nhân Android phone Siêu CPU điện thoại gaming dt giá rẻ,3169878955,https://sg-test-11.slatic.net/p/596ac1252089f22c78628378a4b8c070.jpg,1.099.847 ₫,Voucher giảm  47%,,,Hà Nội,O้racl1e021,No Brand,2068682,True,https://www.lazada.vn/products/pdp-i3169878955.html
Điện thoại thông minh Honor X7c 16(8+8)GB + 256GB | Pin 6000mAh sạc nhanh 35W | Camera 108MP|Chip Snapdragon 685| Loa kép | Kháng nước IP64 | BH 18 Tháng Hàng chính hãng,2836739334,https://vn-live-01.slatic.net/p/6c2a882c2c462233312d3b4823a3b588.png,4.589.000 ₫,,4.932203389830509,59,Long An,HONOR Vietnam,Honor,5490000,True,https://www.lazada.vn/products/pdp-i2836739334.html
"Điện thoại Nubia V70 Max 8(4+4)GB/128GB I Pin 6000mAh I 6.9""120Hz I Chống rơi vỡ*",3048707585,https://sg-test-11.slatic.net/p/d4770cece1ef841e13bc6977d3a2caf6.jpg,2.350.000 ₫,,5.0,16,Hồ Chí Minh,Nubia Redmagic,nubia,2790000,True,https://www.lazada.vn/products/pdp-i3048707585.html
đt giá học sinh Chính Hãng điện thoại pin trâu Màn hình lớn 6.7 inch điện thoại rẻ nhất Pin trâu 6800mAh điện thoại rẻ Màn hình AMOLED điện thoại gaming Siêu CPU điện thoại cảm ứng giá rẻ Android Đt Siêu mượt đ𝗂ện thoạ𝗂 chính hãng g𝗂á rẻ,3065335097,https://vn-live-01.slatic.net/p/1b15467f686403654fdb4010655ba7a9.jpg,1.101.738 ₫,Voucher giảm  48%,,,Hà Nội,Pzi5i125,No Brand,2104175,True,https://www.lazada.vn/products/pdp-i3065335097.html
Điện thoại smartphone 0PP0 A3S chính hãng,2374196581,https://vn-live-01.slatic.net/p/b30cc2fa69844ceab2d695bddad18e3c.jpg,999.000 ₫,,,,Quảng Ngãi,Thế Giới Điện Thoại Hải Anh,OPPO,,True,https://www.lazada.vn/products/pdp-i2374196581.html
giá bán rẻ Hàng mới về Feature phones Sạc nhanh Nguyên bản mới Pin trâu 5000mAh điện thoại thông minh bản Quốc tế Giao hàng nhận tiền Màn hình lớn 7.3 inchĐiện Thoại Thông Minh siêu mượt đt giá rẻ chính hãng Chính Hãn,3169921290,https://sg-test-11.slatic.net/p/b62a0a8515c819924da0ca9dca4535fe.jpg,1.368.337 ₫,Voucher giảm  47%,,,Hà Nội,O้racl1e021,No Brand,2581768,True,https://www.lazada.vn/products/pdp-i3169921290.html
Camera 64+32MP dt giá rẻ Thẻ 2 sim viettel giá rẻ Smartphone Pin Lớn 6800mAh Điện thoại di động Tiếng Việt Mobilephone Android Feature phones,3121059845,https://sg-test-11.slatic.net/p/e3eaee77d2d63bbb936ea839148e5e1d.jpg,1.194.714 ₫,Voucher giảm  48%,,,Hà Nội,Pzi5i125,No Brand,2297527,True,https://www.lazada.vn/products/pdp-i3121059845.html
điện thoại Giá Rẻ 6.7inch Màn hình FHD giá rẻ học sinh Android Siêu CPU Bộ nhớ 12+512GB Hàng Chính Hãng Android gaming phone đt giá rẻ chính hãng,2300869235,https://vn-live-01.slatic.net/p/358e5fc6401bc012ec4f2252197187f8.jpg,1.211.099 ₫,Voucher giảm  43%,,,Hà Nội,O้racl1e021,No Brand,2124735,True,https://www.lazada.vn/products/pdp-i2300869235.html
Đt đánh mọi gaming nặng chất điên thoại mướt game đt giá rẻ chính hãng Camera 108+72MP điện thoại thông minh bản Quốc tế Cellphones,2608128307,https://vn-live-01.slatic.net/p/e886ab0785048210ceb3e27fc6268264.jpg,1.023.934 ₫,Voucher giảm  48%,,,Hà Nội,ysa6r589,No Brand,1969104,True,https://www.lazada.vn/products/pdp-i2608128307.html
JIAYOU MIX SE bàn phím chuột ăn gà 5 miếng bộ đa chức năng điện thoại di động trò chơi chuyển đổi,3182289818,https://sg-test-11.slatic.net/p/27f7c2a011ac170df75cf995e7e036d6.jpg,128.720 ₫,Voucher giảm  47%,,,Hồ Chí Minh,Sumange‌,No Brand,245000,True,https://www.lazada.vn/products/pdp-i3182289818.html
BABY Có thể sạc lại Bàn phím gập không dây mini Thiết kế mỏng Bàn phím Bluetooth Bàn phím điện thoại di động Di động Bàn phím có thể gập lại Du lịch,3152594379,https://sg-test-11.slatic.net/p/7e8695e4930bcb425c30129b2571ea32.jpg,232.000 ₫,Voucher giảm  62%,4.333333333333333,3,China,Baby beares,No Brand,606000,True,https://www.lazada.vn/products/pdp-i3152594379.html
JIAYOU MIX SE bàn phím chuột ăn gà 5 miếng bộ đa chức năng điện thoại di động trò chơi chuyển đổi,3182281882,https://sg-test-11.slatic.net/p/27f7c2a011ac170df75cf995e7e036d6.jpg,128.720 ₫,Voucher giảm  47%,,,Hồ Chí Minh,ketnOAMT,No Brand,245000,True,https://www.lazada.vn/products/pdp-i3182281882.html
Bộ làm mát điện thoại di động PUGB Chơi game Bộ điều khiển di động Quạt làm mát Tản nhiệt đa năng SL17 phukiengame,3153038456,https://sg-test-11.slatic.net/p/0a77963a3eccdf1b2a7b0ccae4135627.jpg,104.900 ₫,Voucher giảm  22%,5.0,1,Hồ Chí Minh,ketnOAMT,No Brand,135079,True,https://www.lazada.vn/products/pdp-i3153038456.html
Bộ làm mát điện thoại di động PUGB Chơi game Bộ điều khiển di động Quạt làm mát Tản nhiệt đa năng SL17 phukiengame,3153419484,https://sg-test-11.slatic.net/p/bc0e3bc51ca5fee2b40b0f2bc666ee9d.jpg,95.000 ₫,Voucher giảm  37%,5.0,1,Hồ Chí Minh,ketnOAMT,No Brand,150000,True,https://www.lazada.vn/products/pdp-i3153419484.html
"(Giao hàng ngay) Bàn phím bluetooth không dây mini HP 10 inch / chuột không dây cho điện thoại di động và máy tính bảng, các màu có sẵn",1594428152,https://vn-live-01.slatic.net/p/eb5c52b5394ef3304fae43ff58e4873a.jpg,89.000 ₫,Voucher giảm  50%,4.761489237929029,1718,Hồ Chí Minh,MOZOE,OEM,178000,True,https://www.lazada.vn/products/pdp-i1594428152.html
(Giao hàng ngay) Bàn phím bluetooth không dây mini HP 10 inch / chuột không dây cho điện thoại di động và máy tính bảng các màu có sẵn,2880467880,https://vn-live-01.slatic.net/p/2a84e0e9a7a3424b2f65b77978f4a178.jpg,137.500 ₫,Voucher giảm  31%,5.0,3,Hồ Chí Minh,Vietstore24h,No Brand,200000,True,https://www.lazada.vn/products/pdp-i2880467880.html
"Điện thoại Nokia 105 4G Pro - Hàng chính hãng - Màn hình IPS LCD 1.77'', hổ trợ 4G, Pin 1450 mAh",2773731549,https://sg-test-11.slatic.net/p/f8bb316943baf6dc99c1bdb6ebe5d15c.jpg,575.000 ₫,Voucher giảm  33%,4.7894736842105265,19,Hà Nội,Cosette,No Brand,859000,True,https://www.lazada.vn/products/pdp-i2773731549.html
Camera nội soi chống nước công nghiệp HD 3 trong 1 Thích hợp cho máy tính bảng và điện thoại di động,3100483639,https://sg-test-11.slatic.net/p/a268de885616cde5ff90fbc75f7cd6dc.jpg,89.000 ₫,,,,Hồ Chí Minh,Phukienonline247,No Brand,,True,https://www.lazada.vn/products/pdp-i3100483639.html
điện thoại màn hình to giá rẻ Vi xử lý 10 nhân đt giá siêu rẻ Pin trâu 6800mAh điện thoại giá rẻ đánh mọi gaming nặng chất Tiếng Việt Android đt rẻ,2963571647,https://vn-live-01.slatic.net/p/c9bd6a92f92fbf6eea595fb318ce7c26.jpg,1.113.961 ₫,Voucher giảm  44%,3.6666666666666665,3,Hà Nội,O้racl1e021,No Brand,1993238,True,https://www.lazada.vn/products/pdp-i2963571647.html
"Blesiya Điện Thoại Có Dây Treo Di Động, Dây Treo Tường Gia Đình, Điện Thoại Kinh Doanh Văn Phòng",1407677826,https://vn-live-01.slatic.net/p/506ae99ea20988d32d82e2749b428763.jpg,257.000 ₫,,5.0,1,China,Blesiya,Blesiya,429000,True,https://www.lazada.vn/products/pdp-i1407677826.html
S23 Ultra 7.5 inch máy điện thoại di động 5G màn hình điện thoại WiFi 120Hz 16GB + 512ROM 6800mah điện thoại di động với có camera kép thẻ SIM điện thoại Android thông minh trò chơi trò chơi điện thoại di động rẻ tiền lớn,2560889335,https://sg-test-11.slatic.net/p/14e5b0cbf21286737f3781adf56171e2.jpg,1.363.099 ₫,Voucher giảm  48%,,,Hà Nội,điện tử kỹ thuật số 3C,SOYES,2646200,True,https://www.lazada.vn/products/pdp-i2560889335.html
Deal Điện Tử Giảm Đến 50% Galaxy S23 Ultra 6.8Inches Hiệu suất cao 16+1TB Pin 6800mAh Thẻ Sim đôi Điện Thoại Di Động,2589109974,https://vn-live-01.slatic.net/p/99bd2ebe5bb496fa791afd1382dfb0af.jpg,1.176.000 ₫,Voucher giảm  45%,,,Hà Nội,điện tử kỹ thuật số 3C,No Brand,2140000,True,https://www.lazada.vn/products/pdp-i2589109974.html
"điện thoại A55 5G (0 p p o - A55.) Chính Hãng 2sim ram 8G/256G, Máy mới nguyên sill ,gồm sạc cáp ốp lưng Cấu hình cao, Cày Game chất, Bảo hành 12 tháng",2137694120,https://vn-live-01.slatic.net/p/21f70f0bb645824fd2b3148907ebc983.jpg,1.679.000 ₫,Voucher giảm  43%,5.0,11,Hồ Chí Minh, shop thúy diễm ,No Brand,2950000,True,https://www.lazada.vn/products/pdp-i2137694120.html
Điện thoại Sharp R6 Nhật Ram 12/128 Snap 888 Zin Đẹp,2590726513,https://vn-live-01.slatic.net/p/0d5765644369f9a5f09d8291bbe83ae5.png,4.398.000 ₫,Voucher giảm  17%,5.0,2,Hồ Chí Minh,Di Động 68 HCM,Sharp,5290000,True,https://www.lazada.vn/products/pdp-i2590726513.html
Nguyên bản mới Mạng 5G điên thoại gia rẻ Hỗ trợ 2 SIM Điện thoại di động 6.8inch điện thoại giá học sinh Bộ nhớ 16+1TB Siêu CPU đt thông minh giá rẻ,3169453898,https://vn-live-01.slatic.net/p/4ea3d39662594b4f871f64091300512f.jpg,1.080.000 ₫,Voucher giảm  36%,,,Hà Nội,điện tử kỹ thuật số 3C,SOYES,1680000,True,https://www.lazada.vn/products/pdp-i3169453898.html
Điện thoại di động tầm cao S23Ultra2023 chính hãng NEW7.3 inch HD 16+1TB bộ nhớ lớn 48+108MP HD chụp ảnh điện thoại di động học tập hỗ trợ wifi 5G pin lớn pin lớn 7800mAh điện thoại thông minh ...,2364104272,https://vn-live-01.slatic.net/p/1a3e24ade608ef37a669d2ec05dd83e1.jpg,1.556.783 ₫,Voucher giảm  50%,,,Hà Nội,Chỉ vì 3C,No Brand,3113566,True,https://www.lazada.vn/products/pdp-i2364104272.html
2024 Original S23 Ultra Android 48MP + 72MP Thẻ SIM Kép 4G/5G 6800mAh 16GB + 1TB 7.3 Inch  Điện Thoại Di Động,2565582800,https://sg-test-11.slatic.net/p/aa884c180d5e9dad2331c4ed27cb9730.jpg,1.357.468 ₫,Voucher giảm  50%,,,Hà Nội,tiệm 3C,No Brand,2714936,True,https://www.lazada.vn/products/pdp-i2565582800.html
Điện thoại Redmi 9A bộ nhớ 32GB máy chính hãng tặng 1 kính cường lực 1 ốp lưng,2557022867,https://vn-live-01.slatic.net/p/1c121f6bc8a1bac335ad1af34df6c06f.jpg,1.014.790 ₫,Voucher giảm  12%,5.0,1,Hồ Chí Minh,Di Động Khmer Sài Gòn,No Brand,1150000,True,https://www.lazada.vn/products/pdp-i2557022867.html
Điện thoại Xiaomi Redmi 8 Ram 4GB bộ nhớ 64GB máy zin full chức năng pin 6000 mAh tặng kèm 1 ốp lưng,2634653587,https://vn-live-01.slatic.net/p/8e7dee17b6a850d25eb80583e7784dbe.jpg,1.290.000 ₫,Voucher giảm  8%,5.0,1,Hồ Chí Minh,Di Động Khmer Sài Gòn,Xiaomi,1400000,True,https://www.lazada.vn/products/pdp-i2634653587.html
Giá Rẻ Học Sinh，S23 Ultra Điện Thoại Chính Hãng Giá Rẻ 7.3Inch Điện Thoại Di Động Bộ Nhớ Lớn 16+512GB Hai Thẻ Sim Camera 32+64MP Pin 6800mAh Chính Hãng Giá Rẻ,2635415603,https://vn-live-01.slatic.net/p/0dd2bff6632c18bcd9358e4b71106f60.jpg,1.237.990 ₫,Voucher giảm  50%,,,Hà Nội,điện tử kỹ thuật số 3C,No Brand,2457980,True,https://www.lazada.vn/products/pdp-i2635415603.html
Điện thoại giá rẻ Trung Quốc Hỗ trợ 2 SIM đt chính hãng Android điện thoại giá 1kk Hỗ trợ kiểm tra hàng hóa handphone Giảm giá sốc bán với giá thấp,3074844770,https://sg-test-11.slatic.net/p/2806045b5328138208c4345c30a6c89d.jpg,1.015.119 ₫,Voucher giảm  47%,,,Hà Nội,Pzi5i125,No Brand,1909161,True,https://www.lazada.vn/products/pdp-i3074844770.html
